{
  "$schema":"https://json-schema.org/draft/2020-12/schema",
  "$id":"fr_prep_b7a_independent_real_outcome_audit_authorization.v1.schema.json",
  "type":"object",
  "required":["schema_version","checkpoint","authorization_scope","committed_artifacts","expected"],
  "properties":{
    "schema_version":{"const":"fr_prep_b7a_independent_real_outcome_audit_authorization.v1"},
    "checkpoint":{"const":"FR_PREP_B7A"},
    "authorization_scope":{"const":"INDEPENDENT_AUDIT_ONLY"},
    "committed_artifacts":{"type":"array","minItems":26,"maxItems":26,"items":{"type":"object","required":["artifact_id","path","file_sha256"],"properties":{"artifact_id":{"type":"string"},"path":{"type":"string","pattern":"^research/"},"file_sha256":{"pattern":"^[0-9a-f]{64}$"}},"additionalProperties":false}},
    "expected":{"type":"object","required":["upstream","b7_output_hashes","datasets","numeric_policy"]}
  },
  "additionalProperties":false
}
